"U.S., Russia to negotiate end of Ukraine war without EU reps, Ukraine input"
Mexico's President Sheinbaum threatens to take legal action over the Gulf name change
Zelensky says Ukraine will not be part of Russia peace talks
Severe storms and flooding roll through the southeast
Peace Talks with Russia; Mexican Street Sweeper Becomes a Star
4 top aides to New York City Mayor Eric Adams resign
"In Chicago, cognitive behavioral therapy shows promise curbing youth violence"
Frigid temperatures and snow are expected across the U.S. this week
When online weight-loss drugs are too good to be true
"Power lines sparked new fires in LA after the Eaton Fire began, radio traffic shows"
Pope Francis' hospital stay is extended due to 'polymicrobial infection'
Understanding presidential power in the age of Trump
Rubio is in Saudi Arabia to discuss the Gaza ceasefire and Ukraine war
"A look at Trump's first month in office. And, how to beat parental burnout"
"Paris Emergency Summit, Marco Rubio in the Middle East, Trump's First Month"
"She suspected a heart attack, but was diagnosed with broken heart syndrome"
Train hoppers ride the rails across America — and you can tag along
A fired national park ranger lost his dream job. He says the public is losing more
Some performers canceled their Kennedy Center shows. Here's why W. Kamau Bell didn't
He once made food for astronauts. Will his new idea survive Trump's funding freeze?
